{"$defs":{"source":{"additionalProperties":false,"properties":{"adapter":{"minLength":1,"type":"string"},"declared_count":{"anyOf":[{"minimum":0,"type":"integer"},{"type":"null"}]},"path":{"minLength":1,"pattern":"^(?:(?!(?:\\.{1,2}|(?:[Cc][Oo][Nn]|[Pp][Rr][Nn]|[Aa][Uu][Xx]|[Nn][Uu][Ll]|[Cc][Oo][Mm][1-9]|[Ll][Pp][Tt][1-9])[ .]*(?:\\.[^/]*)?)(?:/|$))(?=[^/]{1,255}(?:/|$))[^/\\\\:\\x00-\\x1f\\x7f]*[^/\\\\:\\x00-\\x1f\\x7f .])(?:/(?:(?!(?:\\.{1,2}|(?:[Cc][Oo][Nn]|[Pp][Rr][Nn]|[Aa][Uu][Xx]|[Nn][Uu][Ll]|[Cc][Oo][Mm][1-9]|[Ll][Pp][Tt][1-9])[ .]*(?:\\.[^/]*)?)(?:/|$))(?=[^/]{1,255}(?:/|$))[^/\\\\:\\x00-\\x1f\\x7f]*[^/\\\\:\\x00-\\x1f\\x7f .]))*$","type":"string"},"role":{"enum":["assignment","inventory"]},"sha256":{"pattern":"^[0-9a-f]{64}$","type":"string"},"source_id":{"minLength":1,"type":"string"},"system":{"minLength":1,"type":"string"},"tracking":{"enum":["ignored-local","tracked"]}},"required":["adapter","declared_count","path","role","sha256","source_id","system","tracking"],"type":"object"}},"$id":"https://vera20k.local/parity/source-lock.v1.schema.json","$schema":"https://json-schema.org/draft/2020-12/schema","additionalProperties":false,"properties":{"corpus_digest":{"pattern":"^[0-9a-f]{64}$","type":"string"},"importer":{"const":"vera20k-parity-ledger"},"importer_version":{"const":1},"schema_version":{"const":1},"source_set":{"minLength":1,"type":"string"},"sources":{"items":{"$ref":"#/$defs/source"},"type":"array","uniqueItems":true}},"required":["corpus_digest","importer","importer_version","schema_version","source_set","sources"],"title":"VERA20k parity source lock v1","type":"object"}
