{"corpus_digest":"32fef197018d6bbbb258931280d8db8e30b5d2949e8d62bea1b9e52ab3c8ca3c","importer":"vera20k-parity-ledger","importer_version":1,"schema_version":1,"source_set":"bootstrap","sources":[{"adapter":"core-checklist","declared_count":32,"path":"docs/plans/2026-05-29-core-engine-substrate-todo.md","role":"inventory","sha256":"5c793a914ce769e8891242bf15c373e36bac04a781c4067280ffe11a01a96475","source_id":"core-todo","system":"core","tracking":"ignored-local"},{"adapter":"miner-roadmap","declared_count":null,"path":"docs/plans/2026-07-02-miner-parity-roadmap.md","role":"assignment","sha256":"1c064ee6a04d2fcb6936a55d7bb552062501afe0cb0710cd15cb326edf0ad407","source_id":"miner-roadmap","system":"miner","tracking":"ignored-local"},{"adapter":"miner-scan","declared_count":139,"path":"docs/gap-scans/2026-07-02-disparity-scan-miner.md","role":"inventory","sha256":"58a418c124f04303d9b64b46105117e86d80bbb156c2be0ff9f7bfea6dabd213","source_id":"miner-scan","system":"miner","tracking":"ignored-local"},{"adapter":"scheduler-checklist","declared_count":17,"path":"docs/plans/2026-05-28-foundational-scheduler-roadmap-todo.md","role":"inventory","sha256":"b4f7b130539b7c5a72203e389fc18cc4defd88916d513749f4adaa60b7c30ddb","source_id":"scheduler-roadmap","system":"scheduler","tracking":"ignored-local"},{"adapter":"shell-roadmap","declared_count":null,"path":"docs/plans/2026-07-06-shell-ui-parity-roadmap.md","role":"assignment","sha256":"a442dfbf0f8c94d78b856bc8e64c7039d1cf18eba0b3b5ae03ac2830179e76f0","source_id":"shell-roadmap","system":"shell","tracking":"ignored-local"},{"adapter":"shell-scan","declared_count":89,"path":"docs/gap-scans/2026-07-06-disparity-scan-shell-ui.md","role":"inventory","sha256":"7bb004f9bdbe4c397ee30ad783cc1495846401f2790d4d6d8a702ac085415f72","source_id":"shell-scan","system":"shell","tracking":"ignored-local"}]}
